{
  "model_type": "transformer",
  "architecture": {
    "d_model": 512,
    "n_heads": 8,
    "n_layers": 6,
    "d_ff": 2048,
    "vocab_size": 37000,
    "max_seq_len": 512
  },
  "objective": "cross_entropy_with_label_smoothing",
  "key_operations": [
    "scaled_dot_product_attention",
    "layer_norm",
    "positional_encoding"
  ],
  "math_notes": "Q,K,V dims: (batch, seq, d_model/n_heads) — must divide evenly"
}
